{
  "schema_version": "1.0",
  "agent_id": "pi-agent",
  "scaffold": "pi-agent",
  "model": "deepseek/deepseek-v4-pro",
  "runtime_file": "runtime.json",
  "timeout_s": 3600,
  "artifact_policy": {
    "prompt_snapshot": "prompt.txt",
    "redacted_agent_config_snapshot": "agent_config.json",
    "raw_session": "raw/",
    "trace": "trace.json",
    "report": "report.md",
    "verdict": "verdict.json"
  }
}
